<?xml version="1.0" encoding="utf-8"?>
<PlayerDecks xmlns:xsi="http://www.w3.org/2001/XMLSchema-instance" xmlns:xsd="http://www.w3.org/2001/XMLSchema" xsi:noNamespaceSchemaLocation="Decks.xsd">
  <Decks>
    <Deck name="Patient Power">
      <Cards>
        <Card name="Heavy Tower" count="10" />
        <Card name="Basic Upgrade" count="20" />
      </Cards>
    </Deck>
    <Deck name="Prototype Deck">
      <Cards>
        <Card name="Fast Tower" count="2" />
        <Card name="Heavy Tower" count="3" />
        <Card name="Basic Upgrade" count="5" />
        <Card name="Enrage" count="2" />
        <Card name="Basic Tower" count="5" />
        <Card name="Heavy Upgrade" count="2" />
        <Card name="Mana Tap" count="1" />
        <Card name="Shield" count="1" />
        <Card name="Reinforce" count="1" />
        <Card name="Recycle" count="1" />
        <Card name="Summon Swarm" count="1" />
        <Card name="Time Crunch" count="1" />
      </Cards>
    </Deck>
  </Decks>
</PlayerDecks>